{
  "_meta": {
    "schemaVersion": 1,
    "stand": "2026-04-20",
    "quellen": [
      "https://www.stadt-zuerich.ch/ – Organigramm und Departementsseiten",
      "Geschäftsbericht Stadt Zürich – Aufwand pro Dienstabteilung",
      "Beteiligungsbericht Stadt Zürich – verselbständigte Betriebe und Beteiligungen",
      "https://data.stadt-zuerich.ch/ – Personalstatistik (FTE)"
    ],
    "hinweise": [
      "Strukturdaten sind prototypisch – vor Go-Live mit aktuellem Organigramm abgleichen.",
      "Personen bewusst als Rolle gehalten ('Stadtpräsident:in', 'Stadtrat / Stadträtin') – Namen wechseln, Strukturen bleiben länger stabil.",
      "Felder budget und fte sind null und müssen aus Geschäftsbericht / Personalstatistik gespeist werden.",
      "Per-Departement-Aufwand stammt noch aus Budget 2024 (GEMEINDERAT_BESCHLUSS); FTE pro Departement bereits aus Rechnung 2025. Stadtweite Eckwerte aus Geschäftsbericht 2025 unter '_meta.gesamtstadt'. Per-Departement-Refresh aus RECHNUNG/2025 erfordert nächsten Lauf von 'npm run build -- --force' mit RPK_API_KEY."
    ],
    "angereichert": "2026-04-20",
    "quelleEnrichment": "data.stadt-zuerich.ch / fd_rpktool (rpkk-rs/v1)",
    "budgetStand": "2024 (GEMEINDERAT_BESCHLUSS) – per-Departement; Stadt-Total siehe _meta.gesamtstadt (Rechnung 2025)",
    "fteHinweis": "FTE-Werte sind primär Schätzungen (Personalaufwand / 130'000 CHF). 10 Einheit(en) haben publizierte Werte aus Budget-/Rechnungs-PDFs.",
    "fteOverridesAus": "data/manual/fte-publiziert.json",
    "gesamtstadt": {
      "jahr": 2025,
      "phase": "RECHNUNG",
      "aufwand": 10978000000,
      "ertrag": 10955000000,
      "aufwandueberschuss": 22900000,
      "quelle": "Medienmitteilung Stadtrat 'Rechnung 2025 mit knappem Minus' (März 2026); Geschäftsbericht 2025 (April 2026)",
      "quelleUrl": "https://www.stadt-zuerich.ch/de/aktuell/medienmitteilungen/2026/03/rechnung-2025-mit-knappem-minus.html",
      "kontext": "Geschäftsbericht 2025 publiziert April 2026",
      "kontextUrl": "https://www.stadt-zuerich.ch/de/aktuell/publikationen/2026/geschaeftsbericht-2025.html",
      "hinweis": "Stadt-Total aus Pressetext/Geschäftsbericht. Per-Departement-Refresh aus RPK-API (betragsTyp=RECHNUNG, jahr=2025) erfordert lokal 'npm run build -- --force' mit gesetztem RPK_API_KEY – siehe scripts/README.md."
    }
  },
  "center": {
    "id": "stadtrat",
    "name": "Stadtrat",
    "type": "center",
    "note": "Neunköpfige Exekutive der Stadt Zürich. Kollegialbehörde."
  },
  "departments": [
    {
      "id": "PRD",
      "name": "Präsidialdepartement",
      "vorsteher": "Stadtpräsident:in",
      "budget": {
        "jahr": 2024,
        "typ": "GEMEINDERAT_BESCHLUSS",
        "aufwand": 97367300,
        "ertrag": -31905300,
        "nettoaufwand": 129272600,
        "_aggregiertAus": 5
      },
      "fte": {
        "schaetzung": 429.8,
        "einheit": "Stellenwerte (STW)",
        "jahr": 2025,
        "quelle": "pdf",
        "quelleDetail": "Rechnung 2025, S. 30 (Hauptrechnung, Stellenwerte-Tabelle pro Departement)",
        "quelleUrl": "https://www.stadt-zuerich.ch/content/dam/web/de/aktuell/publikationen/2026/rechnung-2025/rechnung-2025-strb.pdf",
        "phase": "Rechnung"
      },
      "odz": {
        "key": "15",
        "kurzname": "PRD",
        "bezeichnung": "Präsidialdepartement"
      }
    },
    {
      "id": "FD",
      "name": "Finanzdepartement",
      "vorsteher": "Stadtrat / Stadträtin",
      "budget": {
        "jahr": 2024,
        "typ": "GEMEINDERAT_BESCHLUSS",
        "aufwand": 949425300,
        "ertrag": -4310759200,
        "nettoaufwand": 5260184500,
        "_aggregiertAus": 4
      },
      "fte": {
        "schaetzung": 1100.6,
        "einheit": "Stellenwerte (STW)",
        "jahr": 2025,
        "quelle": "pdf",
        "quelleDetail": "Rechnung 2025, S. 30",
        "quelleUrl": "https://www.stadt-zuerich.ch/content/dam/web/de/aktuell/publikationen/2026/rechnung-2025/rechnung-2025-strb.pdf",
        "phase": "Rechnung"
      },
      "odz": {
        "key": "20",
        "kurzname": "FD",
        "bezeichnung": "Finanzdepartement"
      }
    },
    {
      "id": "SD",
      "name": "Sozialdepartement",
      "vorsteher": "Stadtrat / Stadträtin",
      "budget": {
        "jahr": 2024,
        "typ": "GEMEINDERAT_BESCHLUSS",
        "aufwand": 1332631500,
        "ertrag": -720915100,
        "nettoaufwand": 2053546600,
        "_aggregiertAus": 6
      },
      "fte": {
        "schaetzung": 1834.6,
        "einheit": "Stellenwerte (STW)",
        "jahr": 2025,
        "quelle": "pdf",
        "quelleDetail": "Rechnung 2025, S. 30",
        "quelleUrl": "https://www.stadt-zuerich.ch/content/dam/web/de/aktuell/publikationen/2026/rechnung-2025/rechnung-2025-strb.pdf",
        "phase": "Rechnung"
      },
      "odz": {
        "key": "55",
        "kurzname": "SD",
        "bezeichnung": "Sozialdepartement"
      }
    },
    {
      "id": "GUD",
      "name": "Gesundheits- und Umweltdepartement",
      "vorsteher": "Stadtrat / Stadträtin",
      "budget": {
        "jahr": 2024,
        "typ": "GEMEINDERAT_BESCHLUSS",
        "aufwand": 1388042000,
        "ertrag": -1125033100,
        "nettoaufwand": 2513075100,
        "_aggregiertAus": 4
      },
      "fte": {
        "schaetzung": 6476.4,
        "einheit": "Stellenwerte (STW)",
        "jahr": 2025,
        "quelle": "pdf",
        "quelleDetail": "Rechnung 2025, S. 30",
        "quelleUrl": "https://www.stadt-zuerich.ch/content/dam/web/de/aktuell/publikationen/2026/rechnung-2025/rechnung-2025-strb.pdf",
        "phase": "Rechnung"
      },
      "odz": {
        "key": "30",
        "kurzname": "GUD",
        "bezeichnung": "Gesundheits- und Umweltdepartement"
      }
    },
    {
      "id": "TED",
      "name": "Tiefbau- und Entsorgungsdepartement",
      "vorsteher": "Stadtrat / Stadträtin",
      "budget": {
        "jahr": 2024,
        "typ": "GEMEINDERAT_BESCHLUSS",
        "aufwand": 654995500,
        "ertrag": -438218400,
        "nettoaufwand": 1093213900,
        "_aggregiertAus": 7
      },
      "fte": {
        "schaetzung": 1864.2,
        "einheit": "Stellenwerte (STW)",
        "jahr": 2025,
        "quelle": "pdf",
        "quelleDetail": "Rechnung 2025, S. 30",
        "quelleUrl": "https://www.stadt-zuerich.ch/content/dam/web/de/aktuell/publikationen/2026/rechnung-2025/rechnung-2025-strb.pdf",
        "phase": "Rechnung"
      },
      "odz": {
        "key": "35",
        "kurzname": "TED",
        "bezeichnung": "Tiefbau- und Entsorgungsdepartement"
      }
    },
    {
      "id": "HBD",
      "name": "Hochbaudepartement",
      "vorsteher": "Stadtrat / Stadträtin",
      "budget": {
        "jahr": 2024,
        "typ": "GEMEINDERAT_BESCHLUSS",
        "aufwand": 488593800,
        "ertrag": -532325000,
        "nettoaufwand": 1020918800,
        "_aggregiertAus": 4
      },
      "fte": {
        "schaetzung": 838.2,
        "einheit": "Stellenwerte (STW)",
        "jahr": 2025,
        "quelle": "pdf",
        "quelleDetail": "Rechnung 2025, S. 30",
        "quelleUrl": "https://www.stadt-zuerich.ch/content/dam/web/de/aktuell/publikationen/2026/rechnung-2025/rechnung-2025-strb.pdf",
        "phase": "Rechnung"
      },
      "odz": {
        "key": "40",
        "kurzname": "HBD",
        "bezeichnung": "Hochbaudepartement"
      }
    },
    {
      "id": "SiD",
      "name": "Sicherheitsdepartement",
      "vorsteher": "Stadtrat / Stadträtin",
      "budget": {
        "jahr": 2024,
        "typ": "GEMEINDERAT_BESCHLUSS",
        "aufwand": 606003000,
        "ertrag": -274004900,
        "nettoaufwand": 880007900,
        "_aggregiertAus": 5
      },
      "fte": {
        "schaetzung": 2823.4,
        "einheit": "Stellenwerte (STW)",
        "jahr": 2025,
        "quelle": "pdf",
        "quelleDetail": "Rechnung 2025, S. 30",
        "quelleUrl": "https://www.stadt-zuerich.ch/content/dam/web/de/aktuell/publikationen/2026/rechnung-2025/rechnung-2025-strb.pdf",
        "phase": "Rechnung"
      },
      "odz": {
        "key": "25",
        "kurzname": "SID",
        "bezeichnung": "Sicherheitsdepartement"
      }
    },
    {
      "id": "SSD",
      "name": "Schul- und Sportdepartement",
      "vorsteher": "Stadtrat / Stadträtin",
      "budget": {
        "jahr": 2024,
        "typ": "GEMEINDERAT_BESCHLUSS",
        "aufwand": 1596275900,
        "ertrag": -231477600,
        "nettoaufwand": 1827753500,
        "_aggregiertAus": 10
      },
      "fte": {
        "schaetzung": 5587.9,
        "einheit": "Stellenwerte (STW)",
        "jahr": 2025,
        "quelle": "pdf",
        "quelleDetail": "Rechnung 2025, S. 30",
        "quelleUrl": "https://www.stadt-zuerich.ch/content/dam/web/de/aktuell/publikationen/2026/rechnung-2025/rechnung-2025-strb.pdf",
        "phase": "Rechnung"
      },
      "odz": {
        "key": "50",
        "kurzname": "SSD",
        "bezeichnung": "Schul- und Sportdepartement"
      }
    },
    {
      "id": "DIB",
      "name": "Departement der Industriellen Betriebe",
      "vorsteher": "Stadtrat / Stadträtin",
      "budget": {
        "jahr": 2024,
        "typ": "GEMEINDERAT_BESCHLUSS",
        "aufwand": 2672751200,
        "ertrag": -2672751200,
        "nettoaufwand": 5345502400,
        "_aggregiertAus": 3
      },
      "fte": {
        "schaetzung": 4177.9,
        "einheit": "Stellenwerte (STW)",
        "jahr": 2025,
        "quelle": "pdf",
        "quelleDetail": "Rechnung 2025, S. 30",
        "quelleUrl": "https://www.stadt-zuerich.ch/content/dam/web/de/aktuell/publikationen/2026/rechnung-2025/rechnung-2025-strb.pdf",
        "phase": "Rechnung"
      },
      "odz": {
        "key": "45",
        "kurzname": "DIB",
        "bezeichnung": "Departement der Industriellen Betriebe"
      }
    }
  ],
  "units": [
    {
      "id": "PRD-stk",
      "parent": "PRD",
      "name": "Stadtkanzlei",
      "kind": "unit",
      "budget": {